{
  "disclaimer": "CFP derived from proposal-grain Functional User Requirements is an approximate early measurement per COSMIC Part 2, not a code-verified count. Epics tagged Assumed/Unknown rest on assumptions and should be re-measured against built artifacts.",
  "rollUp": {
    "projectCfpCountable": 75,
    "cfpRange": [
      0,
      75
    ],
    "epicsMeasured": 12,
    "epicsTotal": 12,
    "countableEpics": 12,
    "epicsRestingOnAssumptions": [
      "E01",
      "E02",
      "E03",
      "E04",
      "E05",
      "E06",
      "E07",
      "E08",
      "E09",
      "E10",
      "E11",
      "E12"
    ],
    "epicsFailed": []
  },
  "rulesPrimer": "I now have all the material needed. Composing the primer.\n\n## COSMIC v5.0 Movement-Counting Primer — Salesforce Delivery Scope\n\n**1. External-system round-trip** (functional process calls another piece of software and gets a response — federated SSO to IdP, outbound API call). Count **2 movements**: one **Exit** (the request leaving to the other software, a functional user across the boundary) + one **Entry** (the response received back). Never Read/Write — another piece of software is a functional user, so its interactions cross the boundary and are handled by Exit/Entry, not persistent-storage movements.\n> Part 2 §3.4 (manuals-indexed/part-2-mm-guidelines-v5-0-sep-2024/03-the-mapping-phase.md#L198-L213): \"Do not identify a Read when the FUR … specify any software or hardware functional user as the source of a data group … Interaction with other functional users is by definition across a boundary … which is handled by an Entry data movement.\" (and symmetrically for Exit at L207-L213)\n\n**2. CRUD on a persistent object** (user-triggered process). Per object of interest: **Create** = Entry (receive data) + Write; **Read** = Entry (receive key/request) + Read + Exit (return data); **Update** = Entry + Read + Write; **Delete** = Entry + one Write (delete is a single Write). One movement of each type per object of interest per process (Rules 13-15).\n> Part 1 §4.5 (manuals-indexed/part-1-mm-principles-definitions-rules-v5-0-aug-2021/04-mapping-phase.md#L134-L149): \"RULE 18: A Read shall: a) retrieve a single data group from persistent storage… RULE 19: A Write shall: a) move data attributes from a single data group to persistent storage… RULE 20: … A requirement to delete a data group … shall be a single Write data movement.\"\n\n**3. Confirmation and error messages to the user.** Count **one Exit** total per functional process, covering all error/confirmation message types from all causes. Extra: if the message carries data beyond confirming acceptance/error, that additional data group is a separate Exit. No Entry/Exit for errors surfaced by a Read/Write or by the OS.\n> Part 2 §3.4 (manuals-indexed/part-2-mm-guidelines-v5-0-sep-2024/03-the-mapping-phase.md#L267-L272): \"One Exit is identified to account for all types of error/confirmation messages issued by any one functional process … from all possible causes … If a message … provides data in addition to confirming … this additional data is identified as a separate data group moved by an Exit.\"\n\n**4. Distinct vs. one functional process.** Two processes are DISTINCT when they respond to different **triggering events**, or when a different **functional user** initiates them. A triggering event cannot be sub-divided and has either happened or not.\n> Part 2 §3.2 (manuals-indexed/part-2-mm-guidelines-v5-0-sep-2024/03-the-mapping-phase.md#L63-L71): \"Identify the separate events … the 'triggering events' … Identify which functional user(s) … may respond to each triggering event … Identify the functional process started by each triggering Entry.\"\n\n**5. Single triggering Entry.** Each functional process is initiated by exactly one Entry from a functional user detecting the triggering event; a single Entry is counted per process. All data movements needed for **all possible responses to that triggering Entry** belong to the same functional process.\n> Part 1 §4.2 (manuals-indexed/part-1-mm-principles-definitions-rules-v5-0-aug-2021/04-mapping-phase.md#L14-L26): \"be initiated by an Entry data movement from a functional user informing the functional process that it has detected a triggering event … 'the set of all data movements that is needed to meet its FUR for all the possible responses to its triggering Entry'.\" (RULE 13, single Entry: L95-L99)\n\n**Caveat:** Every process is ≥2 movements (one Entry + at least one Exit or Write). \"User-triggered\" here assumes a human/UI functional user; a clock-tick or inbound integration is itself a triggering Entry.",
  "epics": [
    {
      "epicId": "E01",
      "epicName": "Log a Lost Pet Report",
      "epicCfp": 8,
      "confidence": "Assumed",
      "functionalUsers": [
        "Contact centre agent (human, via UI)",
        "Caller/resident (recipient of SMS, across boundary)",
        "SMS gateway (peer software)"
      ],
      "functionalProcesses": [
        {
          "functionalProcessId": "FP1-LogLostPetReport",
          "artifact": {
            "type": "epic",
            "name": "Log a Lost Pet Report"
          },
          "dataGroups": [
            {
              "name": "Lost-pet case",
              "description": "The reported case: caller name/contact number, pet species/breed/description, last-seen location and date, plus the generated case reference and status."
            },
            {
              "name": "Microchip record",
              "description": "Registered-pet microchip records held in the animal registry, matched against the reported pet."
            },
            {
              "name": "Found-pet record",
              "description": "Records of pets reported found, matched against the lost-pet report."
            },
            {
              "name": "SMS confirmation",
              "description": "Outbound SMS to the caller carrying the case reference as confirmation of the logged report."
            },
            {
              "name": "Confirmation/error message",
              "description": "On-screen acknowledgment or error surfaced to the agent for the logging action."
            }
          ],
          "dataMovements": [
            {
              "name": "Enter lost-pet report",
              "order": 1,
              "movementType": "E",
              "dataGroupRef": "Lost-pet case",
              "note": "Single triggering Entry: agent submits all data describing the lost-pet case (caller, pet, location/date, contact). One Entry per object of interest (RULE 13/17).",
              "citation": "manuals-indexed/part-1-mm-principles-definitions-rules-v5-0-aug-2021/04-mapping-phase.md#L95-L104"
            },
            {
              "name": "Read microchip records",
              "order": 2,
              "movementType": "R",
              "dataGroupRef": "Microchip record",
              "note": "System checks animal registry for matching microchip records. A Read retrieves a single data group; microchip records are a distinct object of interest (RULE 18).",
              "citation": "manuals-indexed/part-1-mm-principles-definitions-rules-v5-0-aug-2021/04-mapping-phase.md#L134-L143"
            },
            {
              "name": "Read found-pet records",
              "order": 3,
              "movementType": "R",
              "dataGroupRef": "Found-pet record",
              "note": "System checks for matching found-pet records. Distinct object of interest from microchip records, so a separate Read (single data group per Read, RULE 18).",
              "citation": "manuals-indexed/part-1-mm-principles-definitions-rules-v5-0-aug-2021/04-mapping-phase.md#L134-L143"
            },
            {
              "name": "Display microchip matches",
              "order": 4,
              "movementType": "X",
              "dataGroupRef": "Microchip record",
              "note": "Potential microchip matches displayed to the agent. Exit sends a single data group across the boundary (RULE 21).",
              "citation": "manuals-indexed/part-1-mm-principles-definitions-rules-v5-0-aug-2021/04-mapping-phase.md#L130"
            },
            {
              "name": "Display found-pet matches",
              "order": 5,
              "movementType": "X",
              "dataGroupRef": "Found-pet record",
              "note": "Potential found-pet matches displayed to the agent. Distinct object of interest, so a separate Exit consistent with the two Reads.",
              "citation": "manuals-indexed/part-1-mm-principles-definitions-rules-v5-0-aug-2021/04-mapping-phase.md#L130"
            },
            {
              "name": "Create lost-pet case",
              "order": 6,
              "movementType": "W",
              "dataGroupRef": "Lost-pet case",
              "note": "Case persisted to storage; queue routing is taken as owner assignment on the same case object, so one Write per object of interest (RULE 19). See gap CG-E01-04.",
              "citation": "manuals-indexed/part-1-mm-principles-definitions-rules-v5-0-aug-2021/04-mapping-phase.md#L143"
            },
            {
              "name": "Send SMS confirmation with case reference",
              "order": 7,
              "movementType": "X",
              "dataGroupRef": "SMS confirmation",
              "note": "Confirmation SMS carries the case reference (data beyond acceptance confirmation), so it is a separate Exit data group. No documented delivery-receipt response, so no return Entry (see gap CG-E01-03).",
              "citation": "manuals-indexed/part-2-mm-guidelines-v5-0-sep-2024/03-the-mapping-phase.md#L267-L272"
            },
            {
              "name": "Confirmation/error message to agent",
              "order": 8,
              "movementType": "X",
              "dataGroupRef": "Confirmation/error message",